{
  "id": "e1f2a3b4-c5d6-7890-4567-0abcdef01234",
  "actor": {
    "objectType": "Agent",
    "account": {
      "homePage": "https://lms.institution.ac.za",
      "name": "stu-f7a3b2c1"
    }
  },
  "verb": {
    "id": "http://adlnet.gov/expapi/verbs/completed",
    "display": { "en": "completed" }
  },
  "object": {
    "objectType": "Activity",
    "id": "https://lms.institution.ac.za/courses/aclit-2026/modules/03",
    "definition": {
      "type": "http://adlnet.gov/expapi/activities/module",
      "name": { "en": "Module 3: Academic Register" },
      "description": { "en": "Module covering academic register, formal language conventions, and discipline-specific discourse." }
    }
  },
  "result": {
    "completion": true,
    "score": {
      "scaled": 0.82,
      "raw": 82,
      "min": 0,
      "max": 100
    }
  },
  "context": {
    "contextActivities": {
      "grouping": [
        {
          "objectType": "Activity",
          "id": "https://lms.institution.ac.za/sessions/2026-03-08T09-15-00Z/stu-f7a3b2c1",
          "definition": {
            "type": "https://w3id.org/xapi/aclit/v1/activity-types/session",
            "name": { "en": "Learning Session 2026-03-08T09:15:00Z" }
          }
        }
      ],
      "category": [
        {
          "objectType": "Activity",
          "id": "https://w3id.org/xapi/aclit/v1",
          "definition": {
            "type": "http://adlnet.gov/expapi/activities/profile",
            "name": { "en": "Academic Literacies Learning Analytics Profile" }
          }
        }
      ]
    }
  },
  "timestamp": "2026-03-08T11:30:00Z"
}
